{"checks":[{"detail":"none found","fix":"export CURIE_CREDENTIALS=sk-ant-...   (or `curie secrets set CURIE_CREDENTIALS`; `curie skill up --fake-model` needs none)","id":"model-credential","state":"missing","title":"Model credential"},{"detail":"no model determined: per-agent overrides could not be read because the platform API was not reached, no release default agentSandbox.runner.model or inference.model, and no CURIE_MODEL","id":"model-pin","state":"not_applicable","title":"Model pin"},{"detail":"running","id":"docker","state":"ok","title":"Docker"},{"detail":"no .claude-plugin/plugin.json","fix":"curie init my-agent && cd my-agent","id":"bundle","state":"missing","title":"Bundle in this directory"},{"detail":"doctor-stub-context (reached)","id":"cluster","state":"ok","title":"Cluster"},{"detail":"curie (curie-0.8.2)","id":"release","state":"ok","title":"Curie release"},{"detail":"mail adapter not deployed","id":"mail-channel","state":"not_applicable","title":"Mail channel token"},{"detail":"completion outbox: state empty; count 0; inflight 0; retry 0; terminal 0; oldest age 0s","id":"completion-outbox","state":"ok","title":"Completion delivery"},{"detail":"no tokens recorded","fix":"curie cluster comms --slack --namespace curie --release curie --app-token xapp-... --bot-token xoxb-...","id":"slack","state":"missing","title":"Slack"},{"detail":"none — a private repo cannot be cloned, so git-push deploys will fail","fix":"curie cluster github-app --namespace curie --release curie --app-id <id> --private-key ./key.pem","id":"clone-credential","state":"missing","title":"Clone credential"},{"detail":"NodePort 30800","id":"webhook","state":"ok","title":"Webhook exposure"},{"detail":"platform API not reached — could not discover it from the release; pass --api-url/--api-key to include this","id":"repo-binding","state":"not_applicable","title":"Repo binding"}],"deploys_verified":false,"guidance":"4 things to set up. Run `curie` with no arguments for a guided walkthrough, or fix them one at a time with the commands above.","ready":false,"summary":"No bundle here. Start with `curie init my-agent`."}
